{
 "anchoring": {
  "claim_id": "checkpoint_anchoring",
  "does_not_establish": [
   "Bitcoin block inclusion of the checkpoint",
   "seen_block ordering of receipts and payments"
  ],
  "native_reported": {
   "anchor_block_time": 1792632805,
   "anchor_depth": 9,
   "anchor_height": 972551,
   "as_of": 1792627866,
   "head": "746eba10245043374a7845e40877685568f724b268e83de4a9fb9c7bf075f823",
   "size": 13,
   "verified": true
  },
  "reason_codes": [
   "anchor_verification_not_implemented"
  ],
  "verdict": "NOT_ESTABLISHED"
 },
 "classification": "exploratory, retrospective, author-operated; not a holdout, not preregistered, not an independent or external evaluation",
 "dataset_revision": "5b22c203248b0149cd0456f77d32feb887f48ee0",
 "horizon_revision": "b85029de8d22c5246886f4f50ede03da0f54dfcf",
 "independence": "AUTHOR_OPERATED",
 "input_lock_sha256": "1a423378f20b6f4d18f33558da72bd966035d72571bf89b9c277ce1172150bf8",
 "inputs_not_prepared": [],
 "log": {
  "head": "746eba10245043374a7845e40877685568f724b268e83de4a9fb9c7bf075f823",
  "problems": [],
  "request_sha256": {
   "A": "329a112eec9250ea574c4720db74333302a515808be1b0a4b54793e93f2a6fd6",
   "B": "c13a8c64ec5135dab706963c7204c5adb30c12efa8b1d56b9c0900b4fbb32ccc",
   "C": "a5650ab747a92d6b164c1753c731a419f197521691fa29af9a7b86a49f6a2a5f"
  },
  "size": 13,
  "verified": true
 },
 "results": [
  {
   "assumptions": [
    "the bundle's root issuer key is the delegating principal"
   ],
   "case_id": "A",
   "claim_ceiling": "delegation structure of one recorded call, under the bundle's own trust configuration",
   "claim_id": "native_delegation_scope",
   "does_not_establish": [
    "cA2A verify_chain semantics beyond the published credential fields",
    "revocations or policies outside this log",
    "that the work was performed",
    "anything about the budget (see budget_compliance)"
   ],
   "establishes": "the recorded call used a credential signed by the bundle's root issuer, its capability is in the credential's scope, and caller and responder are those the request names",
   "evidence_refs": [
    {
     "entry_sha256": "436624f3c804ab763a23170948aa6aa8905b8d60fb7904855fada377fdc26853",
     "path": "pilot51/set2/log/entries/001_criteria_A.json",
     "seq": 1,
     "sha256": "436624f3c804ab763a23170948aa6aa8905b8d60fb7904855fada377fdc26853"
    },
    {
     "entry_sha256": "b2235a419754c244cbdba990a568f43145920be5d733fc072f6ec9bc5713c4e4",
     "path": "pilot51/set2/log/entries/004_use_A.json",
     "seq": 4,
     "sha256": "b2235a419754c244cbdba990a568f43145920be5d733fc072f6ec9bc5713c4e4"
    },
    {
     "entry_sha256": "68d9df8c7fc40375f6085ec3984ed5938d3f67ccf744583e27461734ea8418d1",
     "path": "pilot51/set2/log/entries/005_payment_A.json",
     "seq": 5,
     "sha256": "68d9df8c7fc40375f6085ec3984ed5938d3f67ccf744583e27461734ea8418d1"
    },
    {
     "entry_sha256": "75cf9584536caf8326a9f2ad968f415a0b1ea0c86d4ee7d857ded01a88f03f3d",
     "path": "pilot51/set2/log/entries/006_receipt_A.json",
     "seq": 6,
     "sha256": "75cf9584536caf8326a9f2ad968f415a0b1ea0c86d4ee7d857ded01a88f03f3d"
    }
   ],
   "evidence_subject": "hs51-musubi-2-A",
   "native_reported": {
    "execution_disposition": "within_delegation"
   },
   "observer_or_signer_role": "holder (use), responder (receipt), root issuer (credential)",
   "reason_codes": [
    "all_delegation_predicates_checked"
   ],
   "rule_id": "H55-R01",
   "trust_basis": "keys and trust configuration taken from the frozen public bundle, published by the same author as the records; no independent key provenance",
   "verdict": "ESTABLISHED"
  },
  {
   "assumptions": [
    "payments not in this log did not happen on this lineage"
   ],
   "case_id": "A",
   "claim_ceiling": "arithmetic over signed records; JPY-testnet is a simulated unit",
   "claim_id": "budget_compliance",
   "does_not_establish": [
    "that money moved (the rail receipt is a digest)",
    "that the budget was enforced before the payment: this is a retrospective count, not a pre-dispatch decision",
    "anything about delegation scope"
   ],
   "establishes": "the cumulative total of authenticated, signed payments on this lineage and unit, in log order, against the issuer-signed max_total",
   "evidence_refs": [
    {
     "entry_sha256": "436624f3c804ab763a23170948aa6aa8905b8d60fb7904855fada377fdc26853",
     "path": "pilot51/set2/log/entries/001_criteria_A.json",
     "seq": 1,
     "sha256": "436624f3c804ab763a23170948aa6aa8905b8d60fb7904855fada377fdc26853"
    },
    {
     "entry_sha256": "b2235a419754c244cbdba990a568f43145920be5d733fc072f6ec9bc5713c4e4",
     "path": "pilot51/set2/log/entries/004_use_A.json",
     "seq": 4,
     "sha256": "b2235a419754c244cbdba990a568f43145920be5d733fc072f6ec9bc5713c4e4"
    },
    {
     "entry_sha256": "68d9df8c7fc40375f6085ec3984ed5938d3f67ccf744583e27461734ea8418d1",
     "path": "pilot51/set2/log/entries/005_payment_A.json",
     "seq": 5,
     "sha256": "68d9df8c7fc40375f6085ec3984ed5938d3f67ccf744583e27461734ea8418d1"
    },
    {
     "entry_sha256": "75cf9584536caf8326a9f2ad968f415a0b1ea0c86d4ee7d857ded01a88f03f3d",
     "path": "pilot51/set2/log/entries/006_receipt_A.json",
     "seq": 6,
     "sha256": "75cf9584536caf8326a9f2ad968f415a0b1ea0c86d4ee7d857ded01a88f03f3d"
    },
    {
     "entry_sha256": "6c627d368f522c796d12a3ad38234e4b9de22f59c30010fd3fc4b7bdba03fabc",
     "path": "pilot51/set2/log/entries/000_budget.json",
     "seq": 0,
     "sha256": "6c627d368f522c796d12a3ad38234e4b9de22f59c30010fd3fc4b7bdba03fabc"
    }
   ],
   "evidence_subject": "hs51-musubi-2-A",
   "native_reported": {
    "payment_budgets": [
     {
      "hop": 0,
      "limit": 20000,
      "total": 7000,
      "unit": "JPY-testnet"
     }
    ],
    "payment_reasons": []
   },
   "observer_or_signer_role": "payer (payment), issuer (budget policy)",
   "reason_codes": [
    "cumulative_total_7000_within_20000"
   ],
   "rule_id": "H55-R02",
   "trust_basis": "keys and trust configuration taken from the frozen public bundle, published by the same author as the records; no independent key provenance",
   "verdict": "ESTABLISHED"
  },
  {
   "assumptions": [],
   "case_id": "A",
   "claim_ceiling": "binding of signed records to one request occurrence",
   "claim_id": "same_request_occurrence",
   "does_not_establish": [
    "that the raw request bodies are the ones described (they are not public)"
   ],
   "establishes": "the use, payment, execution receipt and criteria commitment all name the SHA-256 of this case's request occurrence, distinct from the other cases'",
   "evidence_refs": [
    {
     "entry_sha256": "436624f3c804ab763a23170948aa6aa8905b8d60fb7904855fada377fdc26853",
     "path": "pilot51/set2/log/entries/001_criteria_A.json",
     "seq": 1,
     "sha256": "436624f3c804ab763a23170948aa6aa8905b8d60fb7904855fada377fdc26853"
    },
    {
     "entry_sha256": "b2235a419754c244cbdba990a568f43145920be5d733fc072f6ec9bc5713c4e4",
     "path": "pilot51/set2/log/entries/004_use_A.json",
     "seq": 4,
     "sha256": "b2235a419754c244cbdba990a568f43145920be5d733fc072f6ec9bc5713c4e4"
    },
    {
     "entry_sha256": "68d9df8c7fc40375f6085ec3984ed5938d3f67ccf744583e27461734ea8418d1",
     "path": "pilot51/set2/log/entries/005_payment_A.json",
     "seq": 5,
     "sha256": "68d9df8c7fc40375f6085ec3984ed5938d3f67ccf744583e27461734ea8418d1"
    },
    {
     "entry_sha256": "75cf9584536caf8326a9f2ad968f415a0b1ea0c86d4ee7d857ded01a88f03f3d",
     "path": "pilot51/set2/log/entries/006_receipt_A.json",
     "seq": 6,
     "sha256": "75cf9584536caf8326a9f2ad968f415a0b1ea0c86d4ee7d857ded01a88f03f3d"
    }
   ],
   "evidence_subject": "hs51-musubi-2-A",
   "native_reported": null,
   "observer_or_signer_role": "holder, payer, responder, buyer",
   "reason_codes": [
    "use_payment_receipt_criteria_name_this_request"
   ],
   "rule_id": "H55-R03",
   "trust_basis": "keys and trust configuration taken from the frozen public bundle, published by the same author as the records; no independent key provenance",
   "verdict": "ESTABLISHED"
  },
  {
   "assumptions": [],
   "case_id": "A",
   "claim_ceiling": "ordering and naming in a signed, operator-sequenced log",
   "claim_id": "payment_execution_link",
   "does_not_establish": [
    "that the rail settled the payment",
    "that the result was correct"
   ],
   "establishes": "a signed payment for this request was logged before the signed execution receipt and names the same caller and responder",
   "evidence_refs": [
    {
     "entry_sha256": "436624f3c804ab763a23170948aa6aa8905b8d60fb7904855fada377fdc26853",
     "path": "pilot51/set2/log/entries/001_criteria_A.json",
     "seq": 1,
     "sha256": "436624f3c804ab763a23170948aa6aa8905b8d60fb7904855fada377fdc26853"
    },
    {
     "entry_sha256": "b2235a419754c244cbdba990a568f43145920be5d733fc072f6ec9bc5713c4e4",
     "path": "pilot51/set2/log/entries/004_use_A.json",
     "seq": 4,
     "sha256": "b2235a419754c244cbdba990a568f43145920be5d733fc072f6ec9bc5713c4e4"
    },
    {
     "entry_sha256": "68d9df8c7fc40375f6085ec3984ed5938d3f67ccf744583e27461734ea8418d1",
     "path": "pilot51/set2/log/entries/005_payment_A.json",
     "seq": 5,
     "sha256": "68d9df8c7fc40375f6085ec3984ed5938d3f67ccf744583e27461734ea8418d1"
    },
    {
     "entry_sha256": "75cf9584536caf8326a9f2ad968f415a0b1ea0c86d4ee7d857ded01a88f03f3d",
     "path": "pilot51/set2/log/entries/006_receipt_A.json",
     "seq": 6,
     "sha256": "75cf9584536caf8326a9f2ad968f415a0b1ea0c86d4ee7d857ded01a88f03f3d"
    }
   ],
   "evidence_subject": "hs51-musubi-2-A",
   "native_reported": null,
   "observer_or_signer_role": "payer, responder",
   "reason_codes": [
    "payment_logged_before_its_execution"
   ],
   "rule_id": "H55-R04",
   "trust_basis": "keys and trust configuration taken from the frozen public bundle, published by the same author as the records; no independent key provenance",
   "verdict": "ESTABLISHED"
  },
  {